{
  "category": "semiconductor",
  "componentPorts": [
    {
      "id": "G",
      "name": "G",
      "required": true,
      "type": "input"
    },
    {
      "id": "D",
      "name": "D",
      "required": true,
      "type": "output"
    },
    {
      "id": "S",
      "name": "S",
      "required": true,
      "type": "output"
    }
  ],
  "expectedBoundsClass": "compact",
  "expectedFieldRoles": [
    "reference-field",
    "value-field"
  ],
  "expectedGridPolicy": "ports-on-2.5mm",
  "expectedParameterIds": [],
  "expectedPortCount": 3,
  "expectedPrimitiveFamilies": [
    "circle",
    "line",
    "polygon",
    "polyline",
    "text"
  ],
  "expectedVariantIds": [],
  "expectedVisiblePortCount": 3,
  "formatVersion": "1.0",
  "id": "S025",
  "knownExclusions": [],
  "manualReviewChecks": [
    "silhouette-recognizable",
    "ports-attached-to-expected-leads",
    "pin-number-name-separation",
    "reference-value-clear-of-body",
    "polarity-arrow-inversion-state-unambiguous",
    "repeated-geometry-evenly-spaced",
    "normal-scale-readable",
    "no-false-connectivity-detail",
    "variant-endpoint-identity-preserved",
    "path-has-no-fill-or-self-intersection-artifact"
  ],
  "optionalCapabilities": [],
  "purpose": "Additional transistor topology and gate-arrow handling",
  "requiredCapabilities": [
    "geometry.circle",
    "geometry.line",
    "geometry.polygon",
    "geometry.polyline",
    "port.mapping",
    "text.field"
  ],
  "schema": "https://schemas.aixem.org/conformance/corpus-case/1",
  "symbolPath": "symbol.aixsym.json",
  "tier": "extended",
  "title": "JFET"
}
