{
  "category": "semiconductor",
  "componentPorts": [
    {
      "id": "1",
      "name": "A",
      "required": true,
      "type": "passive"
    },
    {
      "id": "2",
      "name": "K",
      "required": true,
      "type": "passive"
    }
  ],
  "expectedBoundsClass": "compact",
  "expectedFieldRoles": [
    "reference-field",
    "value-field"
  ],
  "expectedGridPolicy": "ports-on-2.5mm",
  "expectedParameterIds": [],
  "expectedPortCount": 2,
  "expectedPrimitiveFamilies": [
    "group",
    "line",
    "polygon",
    "polyline",
    "text",
    "use"
  ],
  "expectedVariantIds": [],
  "expectedVisiblePortCount": 2,
  "formatVersion": "1.0",
  "id": "S007",
  "knownExclusions": [],
  "manualReviewChecks": [
    "silhouette-recognizable",
    "ports-attached-to-expected-leads",
    "pin-number-name-separation",
    "reference-value-clear-of-body",
    "polarity-arrow-inversion-state-unambiguous",
    "repeated-geometry-evenly-spaced",
    "normal-scale-readable",
    "no-false-connectivity-detail",
    "variant-endpoint-identity-preserved",
    "path-has-no-fill-or-self-intersection-artifact"
  ],
  "optionalCapabilities": [],
  "purpose": "Diode body with repeated emission arrows",
  "requiredCapabilities": [
    "geometry.line",
    "geometry.polygon",
    "geometry.polyline",
    "port.mapping",
    "structure.group",
    "structure.use",
    "text.field"
  ],
  "schema": "https://schemas.aixem.org/conformance/corpus-case/1",
  "symbolPath": "symbol.aixsym.json",
  "tier": "core",
  "title": "LED"
}
